{"accent":{"type":"color","value":"#FF22D3EE"},"background":{"type":"color","value":"#FF030712"},"cornerRadius":{"type":"dimension","unit":"dp","value":20.0},"error":{"type":"color","value":"#FFFFB4AB"},"keyboardAccent":{"type":"color","value":"#FF8A2BE2"},"keyboardBackground":{"type":"color","value":"#FF07080B"},"keyboardKeyBackground":{"type":"color","value":"#FF0D0E15"},"keyboardKeyRadius":{"type":"dimension","unit":"dp","value":8},"keyboardKeyText":{"type":"color","value":"#FFF2EEFA"},"link":{"type":"color","value":"#FF8A2BE2"},"navigationBarBackground":{"type":"color","value":"#FF07080B"},"navigationBarIcons":{"type":"color","value":"#FFF2EEFA"},"notificationBackground":{"type":"color","value":"#FF0D0E15"},"notificationText":{"type":"color","value":"#FFF2EEFA"},"onAccent":{"type":"color","value":"#FF001F25"},"outline":{"type":"color","value":"#FF494356"},"quickPanelBackground":{"type":"color","value":"#FF07080B"},"quickTileActive":{"type":"color","value":"#FF8A2BE2"},"quickTileIconActive":{"type":"color","value":"#FFFFFFFF"},"quickTileIconInactive":{"type":"color","value":"#FFB6B0C9"},"quickTileInactive":{"type":"color","value":"#FF1C1D26"},"quickTileRadius":{"type":"dimension","unit":"dp","value":20},"settingsBackground":{"type":"color","value":"#FF07080B"},"settingsIcon":{"type":"color","value":"#FF8A2BE2"},"statusBarIcons":{"type":"color","value":"#FFF2EEFA"},"surface":{"type":"color","value":"#FF0D0E15"},"textPrimary":{"type":"color","value":"#FFF2EEFA"},"textSecondary":{"type":"color","value":"#FFB6B0C9"}}
