{"accent":{"type":"color","value":"#FF0E7490"},"background":{"type":"color","value":"#FFF8FAFC"},"cornerRadius":{"type":"dimension","unit":"dp","value":16.0},"error":{"type":"color","value":"#FFBA1A1A"},"keyboardAccent":{"type":"color","value":"#FF6F21B5"},"keyboardBackground":{"type":"color","value":"#FFE4E7EF"},"keyboardKeyBackground":{"type":"color","value":"#FFFFFFFF"},"keyboardKeyRadius":{"type":"dimension","unit":"dp","value":8},"keyboardKeyText":{"type":"color","value":"#FF171B24"},"link":{"type":"color","value":"#FF6F21B5"},"navigationBarBackground":{"type":"color","value":"#FFF7F8FC"},"navigationBarIcons":{"type":"color","value":"#FF171B24"},"notificationBackground":{"type":"color","value":"#FFFFFFFF"},"notificationText":{"type":"color","value":"#FF171B24"},"onAccent":{"type":"color","value":"#FFFFFFFF"},"outline":{"type":"color","value":"#FF747F90"},"quickPanelBackground":{"type":"color","value":"#FFF7F8FC"},"quickTileActive":{"type":"color","value":"#FF6F21B5"},"quickTileIconActive":{"type":"color","value":"#FFFFFFFF"},"quickTileIconInactive":{"type":"color","value":"#FF505967"},"quickTileInactive":{"type":"color","value":"#FFE4E7EF"},"quickTileRadius":{"type":"dimension","unit":"dp","value":20},"settingsBackground":{"type":"color","value":"#FFF7F8FC"},"settingsIcon":{"type":"color","value":"#FF6F21B5"},"statusBarIcons":{"type":"color","value":"#FF171B24"},"surface":{"type":"color","value":"#FFFFFFFF"},"textPrimary":{"type":"color","value":"#FF171B24"},"textSecondary":{"type":"color","value":"#FF505967"}}
